,sentence,monetary_topic,sentence_root,select,temp_score,dic_score_0,dic_score_1,dic_score_2,dic_score_3,dic_score_4,dic_score_5,dic_score_6,dic_score_7,dic_score_8
526,"Given the deterioration in the inflation and economic outlook and risks of stagnation , the need for a comprehensive strategy to boost growth is particularly relevant in the euro area and Japan",0.0,give deterioration inflation economic outlook risk stagnation need comprehensive strategy boost growth be relevant euro area Japan,0.413714575239869,False,False,False,False,False,False,False,False,False,False
155,"This is becoming increasingly relevant for many emerging economies , notably in Asia ,",0.0,be become relevant many emerge economy Asia,0.4150528764467891,False,False,False,False,False,False,False,False,False,False
397,"In the United States , Federal Reserve policy should remain data dependent",0.0,United States Federal Reserve policy should remain datum dependent,0.41539546844839215,False,False,False,False,False,False,False,False,False,False
29,"While lower oil prices should boost domestic demand , accommodative monetary conditions remain essential in most advanced economies , given still sizable output gaps",0.0,lower oil price should boost domestic demand accommodative monetary condition remain essential most advanced economy give sizable output gap,0.41547566068715824,True,True,True,True,True,True,True,True,False,False
86,It will create greater scope to pursue supportive monetary policy without triggering concern about central bank independence or a resurgence of inflation,0.0,will create greater scope pursue supportive monetary policy trigger concern central bank independence resurgence inflation,0.4158255112978737,False,False,False,False,False,False,False,False,False,False
673,as it could attract capital inflows,0.0,could attract capital inflow,0.4164176218441644,False,False,False,False,False,False,False,False,False,False
151,"At the same time , progress on other fronts is crucial",0.0,same time progress other front be crucial,0.4165493111935845,False,False,False,False,False,False,False,False,False,False
476,Policies need to accelerate the rebalancing of demand from public to private sources in advanced economies and from external deficit to surplus economies,0.0,policy need accelerate rebalancing demand public private source advanced economy external deficit surplus economy,0.4172569783316942,False,False,False,False,False,False,False,False,False,False
396,"where financial stability remains fragile , or key markets are not yet functioning , central banks may need to maintain measures or possibly introduce new targeted ones , even within the context of an overall tightening of the monetary policy stance",0.0,financial stability remain fragile key market be function central bank may need maintain measure introduce new target one context overall tightening monetary policy stance,0.41766943952298363,True,True,True,True,True,True,True,True,True,True
25,the proposed adjustments to the policy mix would also contribute to more sustainable growth,0.0,propose adjustment policy mix would contribute more sustainable growth,0.4182606730146722,False,False,False,False,False,False,False,False,False,False
117,"Additionally , to sustain recovery in these countries some of the consolidation planned for 2011 might also have to be temporarily postponed",0.0,sustain recovery country consolidation plan might have be postpone,0.4209222992610997,False,False,False,False,False,False,False,False,False,False
362,"Where required and feasible , more supportive macroeconomic policies can reduce the impact on growth",0.0,require feasible supportive macroeconomic policy can reduce impact growth,0.4218316725787159,False,False,False,False,False,False,False,False,False,False
428,that help ease credit constraints on firms and households,0.0,help ease credit constraint firm household,0.42202110759523004,False,False,False,False,False,False,False,False,False,False
9,the exchange rate act as a buffer against shocks,0.0,exchange rate act buffer shock,0.4238567139572611,False,False,False,False,False,False,False,False,False,False
480,Reinforcing the growth momentum requires the right mix of demand support and supply reforms,0.0,reinforce growth momentum require right mix demand support supply reform,0.42569953151539486,False,False,False,False,False,False,False,False,False,False
372,While many emerging market and developing economies,0.0,many emerge market develop economy,0.4284971885162794,False,False,False,False,False,False,False,False,False,False
672,"In those economies with broadly balanced external positions , monetary tightening may be complicated",1.0,economy balanced external position monetary tightening may be complicate,0.42964444570148397,True,True,True,True,True,True,True,True,True,True
160,Monetary easing can be the first line of defense against liquidity pressures and downside risks,0.0,Monetary ease can be first line defense liquidity pressure downside risk,0.42969448584498804,False,False,False,False,False,False,False,False,False,False
614,"Reversing financial fragmentation for example , reducing financial home bias , improving bank flows",0.0,reverse financial fragmentation example reduce financial home bias improve bank flow,0.4312222161562156,False,False,False,False,False,False,False,False,False,False
325,where strong nominal anchors are not well established .,0.0,strong nominal anchor be establish,0.4319865343586661,False,False,False,False,False,False,False,False,False,False
623,"Monetary policy tightening may encourage these flows ,",1.0,Monetary policy tightening may encourage flow,0.432493616905529,True,True,True,True,True,True,True,True,True,True
514,Repair and reform of financial systems critical to the normalization of credit conditions in several countries and to prevent contagion needs to be accelerated,0.0,repair reform financial system critical normalization credit condition several country prevent contagion need be accelerate,0.43382806049816436,False,False,False,False,False,False,False,False,False,False
150,Policymakers should employ appropriate macro and tools to mitigate such outcomes,0.0,policymaker should employ appropriate macro tool mitigate such outcome,0.435438563214555,False,False,False,False,False,False,False,False,False,False
884,including by agreeing on a common policy response to the refugee surge and securing external borders,0.0,include agree common policy response refugee surge secure external border,0.4384866200902211,False,False,False,False,False,False,False,False,False,False
877,measures should be formulated in the near future,0.0,measure should be formulate near future,0.4389898718008699,False,False,False,False,False,False,False,False,False,False
48,"However , where shares of food and energy in consumption are high and policy credibility is low ,",0.0,share food energy consumption be high policy credibility be low,0.44258856092708876,False,False,False,False,False,False,False,False,False,False
723,"that growth has slowed , and planned fiscal consolidation , current monetary policy accommodation should remain as long",0.0,growth have slow plan fiscal consolidation current monetary policy accommodation should remain long,0.4434672800704582,True,True,True,True,True,True,True,True,False,False
707,"A heavy reliance on unconventional monetary policy UMP , for example , has had overall positive effects and has bought time but needs support from other policies to succeed",0.0,heavy reliance unconventional monetary policy ump example have have overall positive effect have buy time need support other policy succeed,0.44540171601174317,True,True,True,True,True,False,False,False,False,False
770,"With shrinking fiscal buffers , many commodity exporters need to develop new growth models and tackle fiscal adjustment , including through reduced but more efficient public expenditures , stronger fiscal frameworks , and mobilizing new sources of revenues",0.0,shrink fiscal buffer many commodity exporter need develop new growth model tackle fiscal adjustment include reduce efficient public expenditure stronger fiscal framework mobilize new source revenue,0.4482423506837636,False,False,False,False,False,False,False,False,False,False
837,"In emerging economies , managing vulnerabilities and rebuilding resilience are high priorities in a context of tightening external financial conditions",0.0,emerge economy manage vulnerability rebuild resilience be high priority context tighten external financial condition,0.4493922858698175,False,False,False,False,False,False,False,False,False,False
395,"The key objective will be to maintain price stability , but",0.0,key objective will be maintain price stability,0.44949975318459034,False,False,False,False,False,False,False,False,False,False
735,Clear communication of central bank intentions is vital to help avoid new financial excesses or abrupt reversals of capital flows,0.0,clear communication central bank intention be vital help avoid new financial excess abrupt reversal capital flow,0.4507872508480123,False,False,False,False,False,False,False,False,False,False
13,until a durable recovery is in sight,1.0,durable recovery be sight,0.45204706470091127,False,False,False,False,False,False,False,False,False,False
159,where market concerns regarding public debt sustainability are high or rising,0.0,market concern regard public debt sustainability be high rise,0.45237026700371874,False,False,False,False,False,False,False,False,False,False
671,"In the United States , monetary policy normalization should continue to be gradual and data driven",1.0,United States monetary policy normalization should continue be gradual datum drive,0.45325895269555705,True,True,True,True,True,True,True,True,False,False
845,"Also , a tightening of the fiscal stance may help monetary and debt management ,",0.0,tightening fiscal stance may help monetary debt management,0.4544371590120896,True,True,True,True,True,True,True,True,True,True
840,fiscal and structural policies,0.0,fiscal structural policy,0.455209489045728,False,False,False,False,False,False,False,False,False,False
116,that external financial conditions both availability of capital flows and borrowing costs will eventually tighten,0.0,external financial condition availability capital flow borrowing cost will tighten,0.4561909631654789,False,False,False,False,False,False,False,False,False,False
449,"It will also make systemic institutions more resilient , help contain asset price and credit dynamics , and cushion",0.0,will make systemic institution resilient help contain asset price credit dynamics cushion,0.4567834692835889,False,False,False,False,False,False,False,False,False,False
764,where it is limited considering possible tradeoffs between building buffers and slowing growth and strengthen policy frameworks,0.0,be limited consider possible tradeoff building buffer slow growth strengthen policy framework,0.4607152414865884,False,False,False,False,False,False,False,False,False,False
348,Sustainably higher and inclusive growth requires more forceful and comprehensive policies,0.0,higher inclusive growth require forceful comprehensive policy,0.46076267231612944,False,False,False,False,False,False,False,False,False,False
866,fiscal space should be used actively to provide further additional support,0.0,fiscal space should be use provide further additional support,0.4614440267193961,False,False,False,False,False,False,False,False,False,False
446,"that protracted monetary support has raised financial stability concerns : In the United States , with growth expected to increase above trend in the remainder of 2014 and 2015 , the main policy issue is the appropriate speed of monetary policy normalization",0.0,protracted monetary support have raise financial stability concern United States growth expect increase trend remainder main policy issue be appropriate speed monetary policy normalization,0.4615077931645387,True,True,True,True,True,True,True,True,True,False
89,central banks will need eventually to unwind their extraordinary liquidity support and withdraw conventional and unconventional monetary accommodation,0.0,central bank will need unwind extraordinary liquidity support withdraw conventional unconventional monetary accommodation,0.4640915313830264,True,True,True,True,True,False,False,False,False,False
88,there may be scope for with limited policy easing to support a resumption of growth,0.0,may be scope limited policy ease support resumption growth,0.46503191193792737,False,False,False,False,False,False,False,False,False,False
474,monetary policy measures does not necessarily constrain increases in policy rates,1.0,monetary policy measure do constrain increase policy rate,0.4656412110003175,False,False,False,False,False,False,False,False,False,False
316,"In Brazil , the room for monetary policy easing is limited by underlying inflationary pressures and fiscal consolidation should continue to reduce large deficits",1.0,Brazil room monetary policy easing be limit underlie inflationary pressure fiscal consolidation should continue reduce large deficit,0.4657972505492455,True,True,True,True,True,True,True,True,False,False
560,"In many advanced economies , monetary policy can afford to remain accommodative for an extended period , given subdued price pressures",0.0,many advanced economy monetary policy can afford remain accommodative extended period give subdue price pressure,0.4663529738104206,True,True,False,False,False,False,False,False,False,False
28,who disproportionately shoulder the burden of adjustment,0.0,shoulder burden adjustment,0.4689712745941562,False,False,False,False,False,False,False,False,False,False
320,"Fiscal policy should be growth friendly , with the pace and composition of fiscal adjustment",0.0,fiscal policy should be growth friendly pace composition fiscal adjustment,0.47213512909404387,False,False,False,False,False,False,False,False,False,False
22,as long as inflationary pressures remain in check,0.0,inflationary pressure remain check,0.4726253253070729,False,False,False,False,False,False,False,False,False,False
827,"Thus , the first challenge is",0.0,first challenge be,0.47337852949296155,False,False,False,False,False,False,False,False,False,False
171,"In the United States , agreement on a credible fiscal roadmap could help create some policy space , mitigate risks of excessive consolidation , and ease the burden currently placed on monetary policy",0.0,United States agreement credible fiscal roadmap could help create policy space mitigate risk excessive consolidation ease burden place monetary policy,0.47424090897289206,True,True,True,True,False,False,False,False,False,False
830,"In countries where fiscal adjustment is needed ,",0.0,country fiscal adjustment be need,0.4748638506730316,False,False,False,False,False,False,False,False,False,False
170,as output gaps shrink,0.0,output gap shrink,0.47661494114044556,False,False,False,False,False,False,False,False,False,False
745,The challenges of placing fiscal policy on a sustainable path both political and economic are greater than for normalizing monetary policy,0.0,challenge place fiscal policy sustainable path political economic be greater normalize monetary policy,0.4770077899657843,False,False,False,False,False,False,False,False,False,False
373,"are already raising policy rates , real rates still remain low or even negative",0.0,be raise policy rate real rate remain low negative,0.479200332069908,False,False,False,False,False,False,False,False,False,False
486,that quantitative easing in the United States could result in a flood of capital,0.0,quantitative ease United States could result flood capital,0.48018587872534746,False,False,False,False,False,False,False,False,False,False
595,"Current plans to end tapering later this year and increase policy rates from the middle of next year appear appropriate , given the sizable slack",1.0,current plan end taper year increase policy rate middle next year appear appropriate give sizable slack,0.4802333262682468,True,True,True,True,True,True,True,True,True,False
577,Sovereigns under stress need to continue to adjust and request appropriate EFSF/ESM support,0.0,sovereign stress need continue adjust request appropriate efsf/esm support,0.48123574938139246,False,False,False,False,False,False,False,False,False,False
680,"In emerging Europe , the scope for monetary easing has been limited by the risk of exacerbating capital outflows",0.0,emerge Europe scope monetary easing have be limit risk exacerbate capital outflow,0.4852127938603671,False,False,False,False,False,False,False,False,False,False
351,"Developing clear and effective exit strategies from exceptional policy actions will be central to ensure a smooth return to normal market functioning , to safeguard the sustainability of public finances , and to contain concerns about inflation",0.0,develop clear effective exit strategy exceptional policy action will be central ensure smooth return normal market function safeguard sustainability public finances contain concern inflation,0.4854192007073441,False,False,False,False,False,False,False,False,False,False
806,which requires further monetary tightening,1.0,require further monetary tightening,0.48764457094121905,True,True,True,False,False,False,False,False,False,False
158,"where stimulus measures have contributed directly to a strong rebound in domestic demand , or",0.0,stimulus measure have contribute strong rebound domestic demand,0.4883848971222503,False,False,False,False,False,False,False,False,False,False
436,"Emerging economies need to be nimble in dealing with potentially adverse spillovers from advanced economies , and continue to strengthen macroeconomic policy frameworks",0.0,emerge economy need be nimble deal adverse spillover advanced economy continue strengthen macroeconomic policy framework,0.4912664249532497,False,False,False,False,False,False,False,False,False,False
488,an expansionary fiscal stance has a clear and direct impact on the of debt,0.0,expansionary fiscal stance have clear direct impact debt,0.4920269121937877,False,False,False,False,False,False,False,False,False,False
367,"In most advanced economies , monetary policy is expected to remain appropriately accommodative ,",0.0,most advanced economy monetary policy be expect remain accommodative,0.49231005471473854,False,False,False,False,False,False,False,False,False,False
113,The pace and composition of fiscal adjustment should be attuned to supporting both the recovery and growth,0.0,pace composition fiscal adjustment should be attuned support recovery growth,0.49389216552033754,False,False,False,False,False,False,False,False,False,False
220,"The government should articulate structural measures to underpin the consolidation path , including subsidy reform and progress on the Goods and Services Tax",0.0,government should articulate structural measure underpin consolidation path include subsidy reform progress Goods Services Tax,0.49477743579646183,False,False,False,False,False,False,False,False,False,False
797,Monetary policy tightening may also be necessary,1.0,Monetary policy tightening may be necessary,0.49531920319534883,True,True,True,True,True,True,True,True,True,True
483,"Policy requirements differ vastly among emerging economies , but many can afford to stay on hold or ease",0.0,policy requirement differ emerge economy many can afford stay hold ease,0.49720333215379553,False,False,False,False,False,False,False,False,False,False
191,"These monetary policy efforts should be supported by measures to strengthen bank balance sheets ,",0.0,monetary policy effort should be support measure strengthen bank balance sheet,0.499004281711543,True,True,True,True,True,True,True,True,False,False
465,"Given a path for fiscal policies , monetary policy can be set to achieve a desired level of overall stimulus , tightening",1.0,give path fiscal policy monetary policy can be set achieve desire level overall stimulus tighten,0.5002896870723562,True,True,False,False,False,False,False,False,False,False
192,which would help to improve monetary policy transmission and credit market conditions,0.0,would help improve monetary policy transmission credit market condition,0.5006081704602311,False,False,False,False,False,False,False,False,False,False
521,"declined sharply , with some falling below levels ,",0.0,decline fall level,0.5013495302057693,False,False,False,False,False,False,False,False,False,False
818,"if the central bank has exhausted the sterilization possibilities and risks losing monetary control , or does not want to accumulate further reserves assuming",0.0,central bank have exhaust sterilization possibility risk lose monetary control do want accumulate further reserve assume,0.5022592682104722,False,False,False,False,False,False,False,False,False,False
793,"There is scope for better cooperation on unwinding UMP , especially through wider central bank discussions of exit plans",0.0,be scope better cooperation unwind ump wider central bank discussion exit plan,0.5033027773240162,False,False,False,False,False,False,False,False,False,False
752,External rebalancing should continue,0.0,external rebalancing should continue,0.504689213763947,False,False,False,False,False,False,False,False,False,False
811,"With fiscal stimulus gradually receding , a premature tightening of monetary policy could undercut the recovery",1.0,fiscal stimulus recede premature tightening monetary policy could undercut recovery,0.5051315584854229,True,True,True,True,False,False,False,False,False,False
857,"The Federal Open Market Committee 's FOMC decision should remain , with the first increase in the federal funds rate waiting",0.0,Federal Open Market Committee FOMC decision should remain first increase federal fund rate wait,0.5078772097832607,False,False,False,False,False,False,False,False,False,False
902,"By contrast , most emerging economies are projected to maintain neutral or somewhat contractionary monetary stances , suitably contributing to bring or keep inflation in line with central bank targets",0.0,contrast most emerge economy be project maintain neutral contractionary monetary stance contribute bring keep inflation line central bank target,0.5098922840267786,False,False,False,False,False,False,False,False,False,False
424,"interest rates is not an attractive policy option ,",0.0,interest rate be attractive policy option,0.5116405482446931,False,False,False,False,False,False,False,False,False,False
613,"which highlights the challenges faced by oil exporters with fixed exchange rate regimes for example , Venezuela , Ecuador",0.0,highlight challenge face oil exporter fixed exchange rate regime example Venezuela Ecuador,0.5121792003039723,False,False,False,False,False,False,False,False,False,False
264,Joint efforts by deficit and surplus economies to rebalance global demand would reduce excess external imbalances while sustaining growth,0.0,Joint effort deficit surplus economy rebalance global demand would reduce excess external imbalance sustain growth,0.512363065919315,False,False,False,False,False,False,False,False,False,False
278,"For example , some labor market reforms benefit employment more",0.0,example labor market reform benefit employment,0.5130835607803257,False,False,False,False,False,False,False,False,False,False
500,"which can be reversed quickly , has few obvious direct downsides",0.0,can be reverse have few obvious direct downside,0.5160630455047449,False,False,False,False,False,False,False,False,False,False
494,The Fed has signaled,0.0,Fed have signal,0.5172122796434588,False,False,False,False,False,False,False,False,False,False
275,The principles laid out below are intended to establish common ground for the design and implementation of policies during the exit from extraordinary support measures taken during the crisis,0.0,principle lay be intend establish common ground design implementation policy exit extraordinary support measure take crisis,0.5173662001316697,False,False,False,False,False,False,False,False,False,False
284,as weak balance sheets and confidence are likely to weigh on credit availability,0.0,weak balance sheet confidence be likely weigh credit availability,0.5187733044155106,False,False,False,False,False,False,False,False,False,False
543,"Additional unconventional monetary support targeted long term refinancing operations , lower collateral haircuts could also help reduce fragmentation and restore monetary transmission",1.0,additional unconventional monetary support target long term refinancing operation lower collateral haircut could help reduce fragmentation restore monetary transmission,0.5200427506990497,True,True,True,True,False,False,False,False,False,False
828,when to raise interest rates and the second is,0.0,raise interest rate second be,0.5213265070946347,False,False,False,False,False,False,False,False,False,False
808,Central banks will need to devise plans to exit from unconventional measures to ensure a smooth return to private intermediation and to forestall concerns,0.0,central bank will need devise plan exit unconventional measure ensure smooth return private intermediation forestall concern,0.522846249965201,True,True,True,True,True,False,False,False,False,False
507,Financial stability risks related to a prolonged period of low interest rates bring macro prudential policies to the forefront,0.0,Financial stability risk relate prolonged period low interest rate bring macro prudential policy forefront,0.5228699829010661,False,False,False,False,False,False,False,False,False,False
883,and the monetary union,0.0,monetary union,0.5246273647009628,False,False,False,False,False,False,False,False,False,False
