sentence,hirose_san_score,model_score
when to raise interest rates and the second is,0,0
Central banks will need to devise plans to exit from unconventional measures to ensure a smooth return to private intermediation and to forestall concerns,0,1
Financial stability risks related to a prolonged period of low interest rates bring macro prudential policies to the forefront,0,0
and the monetary union,0,0
"Widespread financial , fiscal , and structural impediments need to be addressed to bolster growth and financial stability",0,0
Government budgetary policies are in the process of moving from stimulus to consolidation,0,0
"as the output gap , core inflation falls , and inflation expectations are well anchored",0,0
The financial sector remains the Achilles ' heel of recovery prospects for private demand,0,0
Policy priorities are thus for a coherent macroeconomic policy mix with a credible nominal anchor and good communication,0,0
"It would also be beneficial to reorient spending notably , to protect vulnerable sections of society against commodity price increases",0,0
"However , imbalances based on current policy trajectories are projected to widen again , signaling the need for further underlying adjustment",0,0
It will be important to have clarity on the process and objectives,0,0
Swift implementation and an expansion of the EU scheme to provide public and private investment would raise growth in the short and and have positive spillovers in the region,0,0
"Accordingly , unemployment is not forecast to be much higher in 2010 than before the crisis ,",0,0
"An effective response requires strengthening supervision and frameworks , as well as addressing corporate and banking sector vulnerabilities",0,0
"Achieving fiscal sustainability will be a difficult and prolonged process , making it imperative for consolidation to begin as soon",0,0
"If needed to support demand , fiscal policy provided space",0,0
There is an urgent need for structural reforms to raise potential output in both advanced and emerging economies,0,0
"slack is absorbed , or",0,0
"There is a clear case for the Fed to proceed along a very gradual upward path for the fed funds rate , conscious of global disinflationary trends and confirming along the way",0,0
"central bank actions as well as public interventions have improved the functioning of money , foreign exchange , and commercial paper markets",0,0
