,sentence,monetary_topic,sentence_root,select,temp_score,dic_score_0,dic_score_1,dic_score_2,dic_score_3,dic_score_4,dic_score_5,dic_score_6,dic_score_7,dic_score_8
822,"Accommodative monetary policies should be accompanied by efforts to strengthen balance sheets and credit supply , and by active macroprudential measures",0.0,accommodative monetary policy should be accompany effort strengthen balance sheet credit supply active macroprudential measure,0.0005889604351311251,True,True,True,True,True,True,True,True,False,False
178,"If the economy is not at risk of overheating , the appropriate policy response would be to lower interest rates and to tighten fiscal policy , thus reducing currency appreciation pressures",1.0,economy be risk overheating appropriate policy response would be lower interest rate tighten fiscal policy reduce currency appreciation pressure,0.00605539873970351,True,True,True,True,True,True,True,True,True,False
415,"before unconventional monetary policy stimulus is fully withdrawn In particular , to the extent",0.0,unconventional monetary policy stimulus be withdraw particular extent,0.0068065740689771115,False,False,False,False,False,False,False,False,False,False
814,banking system stability is also a priority,0.0,banking system stability be priority,0.008169521583921702,False,False,False,False,False,False,False,False,False,False
194,Excessive may have built in some sectors credit booms in a number of smaller advanced economies and the underpricing of risks in certain segments of United States financial markets after more than five years of exceptionally low rates,0.0,excessive may have build sector credit boom number smaller advanced economy underpricing risk certain segment United States financial market more year low rate,0.010441902453201757,False,False,False,False,False,False,False,False,False,False
149,increased downside risks to the global economy,0.0,increase downside risk global economy,0.015296516534056726,False,False,False,False,False,False,False,False,False,False
163,"In the United States , improving the transmission of the monetary easing",0.0,United States improve transmission monetary ease,0.01593895068036455,False,False,False,False,False,False,False,False,False,False
739,as the recovery proceeds,0.0,recovery proceeds,0.01790099828796643,False,False,False,False,False,False,False,False,False,False
498,"Importantly , the type , scale , and timing of adjustment should not be the same , but depend on each country 's own circumstances , or efforts may become",0.0,type scale timing adjustment should be same depend country own circumstance effort may become,0.017904180235598588,True,True,True,True,True,True,True,True,True,True
561,"Moreover , where credit intermediation remains impaired ,",0.0,credit intermediation remain impaired,0.019281798039891496,False,False,False,False,False,False,False,False,False,False
416,"that credit markets remain impaired , monetary tightening may need to be led by a raising of policy rates",0.0,credit market remain impaired monetary tightening may need be lead raising policy rate,0.019508403547986775,True,True,True,True,True,True,True,True,True,True
292,"that require increased vigilance ,",0.0,require increase vigilance,0.020020910061754216,False,False,False,False,False,False,False,False,False,False
258,"In the United States , the main policy issue is the appropriate timing and pace of monetary policy normalization",1.0,United States main policy issue be appropriate timing pace monetary policy normalization,0.020769453781090963,True,True,True,True,True,True,True,True,True,False
528,Raising both actual and potential output through a combination of demand support and structural reforms remains a key policy objective,0.0,Raising actual potential output combination demand support structural reform remain key policy objective,0.02153809313931243,False,False,False,False,False,False,False,False,False,False
554,which in some cases may require changes to regulatory and legal structures,0.0,case may require change regulatory legal structure,0.02172748662956525,False,False,False,False,False,False,False,False,False,False
687,The unbalanced recovery across economies suggests,0.0,unbalanced recovery economy suggest,0.022043673715132828,False,False,False,False,False,False,False,False,False,False
694,"Forceful fiscal and monetary stimulus and financial sector support have helped ease financial stress and played an important role in supporting activity , but may need to be maintained for some time",0.0,forceful fiscal monetary stimulus financial sector support have help ease financial stress play important role support activity may need be maintain time,0.02211598639689427,True,True,True,True,True,True,True,True,True,True
715,"Monetary policy can respond more quickly to achieve the desired level of overall stimulus ,",0.0,Monetary policy can respond achieve desire level overall stimulus,0.02452290842659255,False,False,False,False,False,False,False,False,False,False
656,"As some start exiting UMP , communication and cooperation will be key to avoid or manage bouts of financial market volatility",0.0,start exit ump communication cooperation will be key avoid manage bout financial market volatility,0.027366775422229983,False,False,False,False,False,False,False,False,False,False
855,"plans that achieve timely and smooth exits for extraordinary monetary , fiscal , and financial sector interventions , while being careful to avoid a premature withdrawal of support",0.0,plan achieve timely smooth exit extraordinary monetary fiscal financial sector intervention be careful avoid premature withdrawal support,0.027497998505450094,False,False,False,False,False,False,False,False,False,False
238,Targeted programs to ease,0.0,target program ease,0.0290572552129873,False,False,False,False,False,False,False,False,False,False
583,"This requires slowing credit expansion and switching from investment to more , measures",0.0,require slow credit expansion switching investment measure,0.029922383357475213,False,False,False,False,False,False,False,False,False,False
260,"In the meantime , there is some room for a lower policy rate",1.0,meantime be room lower policy rate,0.032825081548578106,False,False,False,False,False,False,False,False,False,False
199,Sustainably lowering inflation will also require further increases in the policy rate and a simpler monetary framework with clear objectives and operational autonomy for the RBI .,0.0,lower inflation will require further increase policy rate simpler monetary framework clear objective operational autonomy RBI,0.0340271842551394,True,True,True,False,False,False,False,False,False,False
590,"The scope to do so will require credible macroeconomic policies and frameworks ,",0.0,scope do will require credible macroeconomic policy framework,0.03447370119795101,False,False,False,False,False,False,False,False,False,False
540,"if downside risks materialize ,",0.0,downside risk materialize,0.03484416772671228,False,False,False,False,False,False,False,False,False,False
305,"In the euro area , bank balance sheet repair remain essential to restore confidence and revive credit growth , and policymakers should make further progress on banking union through a Single Supervisory Mechanism and a Single Resolution Mechanism , and advance structural reforms",0.0,euro area bank balance sheet repair remain essential restore confidence revive credit growth policymaker should make further progress banking union single Supervisory mechanism single resolution mechanism advance structural reform,0.035428827683142594,False,False,False,False,False,False,False,False,False,False
136,"To ensure transmission of tighter monetary conditions to the real economy , central banks will also need to withdraw excess bank reserves created by their exceptional liquidity provision and unconventional measures",1.0,ensure transmission tighter monetary condition real economy central bank will need withdraw excess bank reserve create exceptional liquidity provision unconventional measure,0.035514469319631314,True,True,True,True,True,False,False,False,False,False
352,Policymakers must remain alert to overheating risks as well as rising domestic financial vulnerabilities,0.0,policymaker must remain alert overheate risk rise domestic financial vulnerability,0.03656109206545488,False,False,False,False,False,False,False,False,False,False
652,and support,0.0,support,0.03850987203222511,False,False,False,False,False,False,False,False,False,False
684,"while managing risks to price stability In advanced economies , monetary policy should remain very accommodative and central banks should stand ready to do more if needed",1.0,manage risk price stability advanced economy monetary policy should remain accommodative central bank should stand ready do more need,0.03893270396543347,True,True,True,True,True,True,True,True,False,False
306,The United Kingdom faces similar challenges :,0.0,United Kingdom face similar challenge,0.04278500639897376,False,False,False,False,False,False,False,False,False,False
506,should inflation expectations unexpectedly rise,0.0,should inflation expectation rise,0.04318886013167689,False,False,False,False,False,False,False,False,False,False
329,"National authorities should commit to provide sufficient national backstops ,",0.0,National authority should commit provide sufficient national backstop,0.04379779652845728,False,False,False,False,False,False,False,False,False,False
209,"Monetary policy can remain accommodative in the major advanced countries , but monetary tightening may be considered in some emerging economies facing risks of overheating",1.0,Monetary policy can remain accommodative major advanced country monetary tightening may be consider emerge economy face risk overheate,0.044166927089683616,True,True,True,True,True,True,True,True,True,True
255,"Current projections are for a limited decline in budget deficits of emerging economies in 2011 and 2012 ,",0.0,current projection be limited decline budget deficit emerge economy,0.04424862608822855,False,False,False,False,False,False,False,False,False,False
788,"Specifically : In the United States , the main challenge is to reach the appropriate speed of monetary policy normalization ,",1.0,United States main challenge be reach appropriate speed monetary policy normalization,0.04425768042670253,True,True,True,True,True,True,True,True,True,False
589,which restricts available policy room,0.0,restrict available policy room,0.0461806525254953,False,False,False,False,False,False,False,False,False,False
294,These monetary policy efforts should be supported by measures to strengthen bank balance sheets and thereby improve monetary policy transmission and credit market conditions,0.0,monetary policy effort should be support measure strengthen bank balance sheet improve monetary policy transmission credit market condition,0.0479615551192446,True,True,True,True,True,True,True,True,False,False
333,National backstops should be used,0.0,National backstop should be use,0.0481847642292772,False,False,False,False,False,False,False,False,False,False
231,"In the United States , monetary policy should continue to remain ,",0.0,United States monetary policy should continue remain,0.04863474818402025,True,True,True,True,True,True,True,True,False,False
105,that policy tightening may be needed in some countries,1.0,policy tightening may be need country,0.048788048404383,True,True,True,True,True,True,True,True,True,True
874,"In emerging economies , monetary policy may need to respond more sensitively to inflation shocks from higher commodity prices due to higher mainly for food prices , less so for energy , less inflation expectations , and economies",1.0,emerge economy monetary policy may need respond more inflation shock higher commodity price due higher food price energy less inflation expectation economy,0.05190370631632124,True,True,True,True,True,True,True,True,True,True
868,"An effective monetary policy communication strategy will remain essential , also in light of differences between market and FOMC expectations about the path of interest rates",0.0,effective monetary policy communication strategy will remain essential light difference market fomc expectation path interest rate,0.052349865481238766,True,True,True,True,True,True,True,False,False,False
218,There is a need to put the global financial system on a more resilient footing,0.0,be need put global financial system resilient footing,0.054085652452791955,False,False,False,False,False,False,False,False,False,False
511,"At a global level , there is a pressing need",0.0,global level be press need,0.05432231327888426,False,False,False,False,False,False,False,False,False,False
408,Some emerging economies should remain watchful of inflationary pressures and should not lower interest rates further,1.0,emerge economy should remain watchful inflationary pressure should lower interest rate,0.05516783034536821,True,True,True,True,True,True,True,True,False,False
603,"The situation is more varied across emerging economies , but monetary",0.0,situation be varied emerge economy monetary,0.055321609560272766,False,False,False,False,False,False,False,False,False,False
544,Emerging economies face both and challenges to support growth,0.0,emerge economy face challenge support growth,0.055650388390548144,False,False,False,False,False,False,False,False,False,False
126,To facilitate rebalanced global growth : advanced economies with large current account deficits should transition towards measures to raise savings,0.0,facilitate rebalanced global growth advanced economy large current account deficit should transition measure raise savings,0.056057414564567476,False,False,False,False,False,False,False,False,False,False
383,major advanced economy central banks have reduced policy interest rates to close to the zero interest floor,0.0,major advanced economy central bank have reduce policy interest rate close interest floor,0.05626854310633611,False,False,False,False,False,False,False,False,False,False
629,"the most important risk from this policy stance in the current low inflationary environment is the potential for liquidity spillovers , particularly to domestic asset markets and emerging economies",0.0,important risk policy stance current low inflationary environment be potential liquidity spillover domestic asset market emerge economy,0.05644553397921814,False,False,False,False,False,False,False,False,False,False
537,advanced economies with large surpluses should prioritize structural reforms in labor and product markets,0.0,advanced economy large surplus should prioritize structural reform labor product market,0.05775204205065387,False,False,False,False,False,False,False,False,False,False
355,"With inflationary expectations well anchored , accommodative monetary policy in major advanced economies remains appropriate for now",1.0,inflationary expectation anchor accommodative monetary policy major advanced economy remain appropriate,0.058477404258863386,True,True,True,True,True,True,True,True,True,False
62,"Monetary policy should remain accommodative in advanced economies ,",1.0,Monetary policy should remain accommodative advanced economy,0.058805208060836556,True,True,True,True,True,True,True,True,False,False
817,Monetary and fiscal policies can help to reduce inflows,0.0,Monetary fiscal policy can help reduce inflow,0.05902661691359945,False,False,False,False,False,False,False,False,False,False
302,"Cyclical weakening calls for monetary policy easing , or less tightening , for those economies",1.0,cyclical weakening call monetary policy easing less tightening economy,0.06013175135024362,False,False,False,False,False,False,False,False,False,False
127,"Episodes of volatile capital flows and exchange rates , along with continuing precautionary reserve accumulation , also suggest the need for further collective efforts to strengthen the IMS",0.0,episode volatile capital flow exchange rate continue precautionary reserve accumulation suggest need further collective effort strengthen IMS,0.06265533296068371,False,False,False,False,False,False,False,False,False,False
838,"A successful resolution of the current crisis will thus require a cohesive , comprehensive , and cooperative package of policies across the",0.0,successful resolution current crisis will require cohesive comprehensive cooperative package policy,0.06667190907664178,False,False,False,False,False,False,False,False,False,False
731,Monetary policy should continue supporting demand given the output gaps and ongoing fiscal consolidation,0.0,Monetary policy should continue support demand give output gap ongoing fiscal consolidation,0.06671463878085981,False,False,False,False,False,False,False,False,False,False
391,More coordination is necessary to avoid fragmentation,0.0,more coordination be necessary avoid fragmentation,0.06708269803230815,False,False,False,False,False,False,False,False,False,False
307,"while monetary policy should stay accommodative for now , it might , however , have to be tightened quickly",1.0,monetary policy should stay accommodative might have be tighten,0.06796013066465811,True,True,True,True,True,True,True,True,False,False
187,while maintaining measures aimed at mitigating the social impact of the crisis,0.0,maintain measure aim mitigate social impact crisis,0.0704167275359936,False,False,False,False,False,False,False,False,False,False
491,"The ECB 's monetary policy should be highly accommodative , consistent with its mandate of ensuring price stability",1.0,ECB monetary policy should be accommodative consistent mandate ensure price stability,0.07194175881578357,True,True,True,True,True,True,True,True,False,False
108,where the credibility of monetary policy is high,0.0,credibility monetary policy be high,0.07226077353659899,False,False,False,False,False,False,False,False,False,False
597,allow for greater exchange rate flexibility,0.0,allow greater exchange rate flexibility,0.07243077485215443,False,False,False,False,False,False,False,False,False,False
85,"In some emerging markets , the task is to avoid overheating and prevent the of financial imbalances",0.0,emerge market task be avoid overheating prevent financial imbalance,0.07427668079485372,False,False,False,False,False,False,False,False,False,False
464,"At the same time , strong prudential oversight and supervision of the financial system is essential to address emerging vulnerabilities in both the bank and financial sector owing to ultra low interest rates",0.0,same time strong prudential oversight supervision financial system be essential address emerge vulnerability bank financial sector owe ultra low interest rate,0.07457641009422489,False,False,False,False,False,False,False,False,False,False
184,These monetary measures need to be supplemented by progress on ` third arrow ' structural reforms,0.0,monetary measure need be supplement progress third arrow structural reform,0.07554175725736112,True,True,True,True,True,False,False,False,False,False
426,"In particular , to ensure that the transmission mechanism for monetary policy remains effective ,",0.0,particular ensure transmission mechanism monetary policy remain effective,0.07749462576389887,True,True,True,True,True,True,False,False,False,False
455,The three requirements for a more resilient recovery are sustained but gradual adjustment,0.0,requirement resilient recovery be sustained gradual adjustment,0.07811187177571743,False,False,False,False,False,False,False,False,False,False
705,"In a majority of advanced countries , output gaps remain negative , weak labor markets threaten to permanently scar especially the young in the workforce , and inflation is low and far off target",0.0,majority advanced country output gap remain negative weak labor market threaten scar young workforce inflation be low target,0.07875891676664659,False,False,False,False,False,False,False,False,False,False
469,"In Japan , accelerating structural reforms is critical to boost confidence and contribute to higher domestic demand and favorable dynamics",0.0,Japan accelerate structural reform be critical boost confidence contribute higher domestic demand favorable dynamics,0.07903791652873071,False,False,False,False,False,False,False,False,False,False
230,"Where public debt is elevated , fiscal space should be through consolidation Brazil , India , Mexico",0.0,public debt be elevated fiscal space should be consolidation Brazil India Mexico,0.07986554144727165,False,False,False,False,False,False,False,False,False,False
630,"Where necessary , fiscal consolidation should remain and support policies",0.0,necessary fiscal consolidation should remain support policy,0.08064023703481649,False,False,False,False,False,False,False,False,False,False
297,This is advisable considering both the relative scales of policy adjustment required and managing risks to both economic and financial recovery,0.0,be advisable consider relative scale policy adjustment require manage risk economic financial recovery,0.0814728816915139,False,False,False,False,False,False,False,False,False,False
650,"Notwithstanding conceptual difficulties in gauging effectiveness ,",0.0,conceptual difficulty gauge effectiveness,0.08318370020687926,False,False,False,False,False,False,False,False,False,False
538,that would bolster domestic demand,0.0,would bolster domestic demand,0.08483723265488496,False,False,False,False,False,False,False,False,False,False
363,"Most emerging economies need to bolster their financial stability frameworks to cope with volatile capital flows , including notably from sharp swings in global risk aversion .",0.0,most emerge economy need bolster financial stability framework cope volatile capital flow include sharp swing global risk aversion,0.08489617288376239,False,False,False,False,False,False,False,False,False,False
795,"In some emerging economies for example , Brazil , emerging Asia , owing to rapidly closing output gaps or concerns about credit quality , monetary accommodation is already being removed or will need be to be removed relatively soon",1.0,emerge economy example Brazil emerge Asia owe close output gap concern credit quality monetary accommodation be be remove will need be be remove,0.08529553911257637,True,True,True,True,True,False,False,False,False,False
713,"than warranted , given the massive purchases by various central banks of government paper since 2008",0.0,warrant give massive purchase various central bank government paper,0.08557842506270386,False,False,False,False,False,False,False,False,False,False
781,"consolidation is appropriate and should be supported by measures for example , in Italy",0.0,consolidation be appropriate should be support measure example Italy,0.08865923999076875,False,False,False,False,False,False,False,False,False,False
642,can continue to be a strong locomotive of global economic and trade growth through structural reforms,0.0,can continue be strong locomotive global economic trade growth structural reform,0.08938252681005299,False,False,False,False,False,False,False,False,False,False
190,that the recovery is expected to remain sluggish going forward,0.0,recovery be expect remain sluggish go,0.08957797934054068,False,False,False,False,False,False,False,False,False,False
459,Room for monetary easing is also more limited,1.0,room monetary easing be limited,0.09029801226512524,False,False,False,False,False,False,False,False,False,False
219,"High unemployment and large output gaps are keeping wages and inflation expectations in the major advanced economies in check , notwithstanding large increases in food and energy prices",0.0,high unemployment large output gap be keep wages inflation expectation major advanced economy check large increase food energy price,0.09274662440045967,False,False,False,False,False,False,False,False,False,False
832,while structural reforms should prioritize measures,0.0,structural reform should prioritize measure,0.09310727300119104,False,False,False,False,False,False,False,False,False,False
562,central banks should continue to explore unconventional measures to stimulate economic activity and improve credit flows,1.0,central bank should continue explore unconventional measure stimulate economic activity improve credit flow,0.09380504984760507,True,True,True,True,True,True,True,True,False,False
394,that reduce duality,0.0,reduce duality,0.0940430347404384,False,False,False,False,False,False,False,False,False,False
532,"Large negative growth surprises in euro area countries should not trigger additional consolidation efforts ,",0.0,large negative growth surprise euro area country should trigger additional consolidation effort,0.09449798719523872,False,False,False,False,False,False,False,False,False,False
98,"In most advanced economies , output gaps are still substantial , inflation is below target , and monetary policy remains",0.0,most advanced economy output gap be substantial inflation be target monetary policy remain,0.09578910155779141,False,False,False,False,False,False,False,False,False,False
640,while continuing to wind down policy lending is important to put gross public debt on a firmly downward path and boost market confidence,0.0,continue wind policy lending be important put gross public debt downward path boost market confidence,0.09603068255378033,False,False,False,False,False,False,False,False,False,False
295,"Further action is needed to recapitalize , restructure , or resolve weak banks and improve the flow of credit to the economy , particularly in Europe",0.0,further action be need recapitalize restructure resolve weak bank improve flow credit economy Europe,0.09609240749090342,False,False,False,False,False,False,False,False,False,False
