,sentence,monetary_topic,sentence_root,select,temp_score,dic_score_0,dic_score_1,dic_score_2,dic_score_3,dic_score_4,dic_score_5,dic_score_6,dic_score_7,dic_score_8
145,"For instance , streamlining service or product sector regulations in surplus economies for example , in Japan , Korea , and Germany will encourage domestic demand and relative price adjustments",0.0,instance streamline service product sector regulation surplus economy example Japan Korea Germany will encourage domestic demand relative price adjustment,0.09775432974362153,False,False,False,False,False,False,False,False,False,False
224,"More recently however , inflation expectations have reversed , and the euro has strengthened ,",0.0,inflation expectation have reverse euro have strengthen,0.10194246986065947,False,False,False,False,False,False,False,False,False,False
198,"To benefit most from the additional easing , it should be supported with fiscal , structural , and ambitious incomes policies",0.0,benefit additional ease should be support fiscal structural ambitious income policy,0.10291765308835532,False,False,False,False,False,False,False,False,False,False
743,"For most countries , fiscal consolidation should be a top priority , with monetary policy able to adjust more flexibly to achieve a desired level of overall stimulus",0.0,most country fiscal consolidation should be top priority monetary policy able adjust more achieve desire level overall stimulus,0.10368468804448416,True,True,True,True,True,True,True,True,False,False
711,The effectiveness of the easing in Japan would be enhanced by broadening asset purchases to include more equities and corporate bonds and government bonds with longer maturities and by simultaneously adopting broad structural and fiscal reforms to achieve a sustained recovery,0.0,effectiveness ease Japan would be enhance broaden asset purchase include more equity corporate bond government bond longer maturity adopt broad structural fiscal reform achieve sustained recovery,0.10531667152477209,False,False,False,False,False,False,False,False,False,False
863,if left unaddressed,0.0,leave unaddressed,0.10673650856378936,False,False,False,False,False,False,False,False,False,False
690,"In emerging market economies , solid policy frameworks will be crucial",0.0,emerge market economy solid policy framework will be crucial,0.1072849040180649,False,False,False,False,False,False,False,False,False,False
308,if costs run ahead of productivity growth or,0.0,cost run productivity growth,0.10961904366356812,False,False,False,False,False,False,False,False,False,False
82,Policy priorities have taken on more urgency compared to the February Surveillance Note,0.0,Policy priority have take more urgency compare February Surveillance note,0.10993093274713273,False,False,False,False,False,False,False,False,False,False
403,"Looking forward , the appreciation of exchange rates since the first quarter will help support domestic demand , consistent with broader need to rebalance the global economy towards higher consumption in those economies",0.0,look appreciation exchange rate first quarter will help support domestic demand consistent broader need rebalance global economy higher consumption economy,0.11118039648167255,False,False,False,False,False,False,False,False,False,False
404,that had accumulated reserves before the financial crisis,0.0,have accumulate reserve financial crisis,0.11257663836523402,False,False,False,False,False,False,False,False,False,False
751,"Thus , policy tightening will have to continue",0.0,policy tightening will have continue,0.11293780468811476,False,False,False,False,False,False,False,False,False,False
326,"In Japan , the recent fiscal stimulus makes developing a credible fiscal plan",0.0,Japan recent fiscal stimulus make develop credible fiscal plan,0.1138607503926301,False,False,False,False,False,False,False,False,False,False
487,These economies should also consider greater emphasis on fiscal tightening .,0.0,economy should consider greater emphasis fiscal tightening,0.11417055114459318,True,True,True,True,True,True,True,True,False,False
185,"In general , policy responses should be anchored by sound and credible monetary policy frameworks",0.0,general policy response should be anchor sound credible monetary policy framework,0.11840322571657769,True,True,True,True,True,True,True,True,False,False
524,"More specifically : In India , while external vulnerabilities have moderated and inflation has fallen faster than expected , persistently high inflation expectations and large fiscal deficits remain key macroeconomic challenges",0.0,India external vulnerability have moderate inflation have fall faster expect high inflation expectation large fiscal deficit remain key macroeconomic challenge,0.11860149381969265,False,False,False,False,False,False,False,False,False,False
831,"consolidation should be gradual and as as possible ,",0.0,consolidation should be gradual possible,0.1193777571287098,False,False,False,False,False,False,False,False,False,False
467,"The timing , pace , and sequence of exiting from supportive policies will vary by country , depending on how robust the recovery of private demand as well as financial conditions",0.0,timing pace sequence exit supportive policy will vary country depend robust recovery private demand financial condition,0.12210401708990015,False,False,False,False,False,False,False,False,False,False
213,that may impede this rebalancing would need to be addressed,0.0,may impede rebalancing would need be address,0.12231249529973565,False,False,False,False,False,False,False,False,False,False
282,when fiscal and monetary policies can provide support,0.0,fiscal monetary policy can provide support,0.12386978012827554,True,True,False,False,False,False,False,False,False,False
783,"that the ratio of debt to GDP is on a downward path , while supporting the potential of the economy",0.0,ratio debt GDP be downward path support potential economy,0.12457750261450995,False,False,False,False,False,False,False,False,False,False
468,"With multiple interdependent factors holding back growth , policymakers have to work all necessary levers structural policies including to promote financial stability and trade , fiscal policies , and monetary policy",0.0,multiple interdependent factor hold growth policymaker have work necessary lever structural policy include promote financial stability trade fiscal policy monetary policy,0.12777930859036157,False,False,False,False,False,False,False,False,False,False
206,But this must be accompanied by macro prudential measures and enhanced financial supervision,0.0,must be accompany macro prudential measure enhance financial supervision,0.13302483841020207,False,False,False,False,False,False,False,False,False,False
771,"Given falling confidence and activity as well as inflation expectations , monetary policy in advanced economies should remain very accommodative",1.0,give fall confidence activity inflation expectation monetary policy advanced economy should remain accommodative,0.13416493999779044,True,True,True,True,True,True,True,True,False,False
450,the consequences of liquidity squeezes if volatility spikes,0.0,consequence liquidity squeeze volatility spike,0.13425293643476965,False,False,False,False,False,False,False,False,False,False
279,when demand is already strong,0.0,demand be strong,0.13520866291132982,False,False,False,False,False,False,False,False,False,False
823,that address financial stability risks,0.0,address financial stability risk,0.13544574540689047,False,False,False,False,False,False,False,False,False,False
154,"Depending on country needs , comprehensive action will combine structural reforms with demand support , anchored by coherent and policy frameworks",0.0,depend country need comprehensive action will combine structural reform demand support anchor coherent policy framework,0.1371480606064941,False,False,False,False,False,False,False,False,False,False
350,which suggests that inflation pressures would be less subdued than in the advanced economies,0.0,suggest inflation pressure would be subdue advanced economy,0.13890808709577807,False,False,False,False,False,False,False,False,False,False
327,that stabilizes and reduces debt even more urgent,0.0,stabilize reduce debt urgent,0.13952505415043925,False,False,False,False,False,False,False,False,False,False
212,"Notwithstanding recent rate hikes in some emerging economies , real interest rates remain far below precrisis levels and hence too low",1.0,recent rate hike emerge economy real interest rate remain precrisis level low,0.14026969493074548,False,False,False,False,False,False,False,False,False,False
792,"In the United Kingdom , still accommodative monetary policy has been combined with macro prudential tools to contain financial stability risks",0.0,United Kingdom accommodative monetary policy have be combine macro prudential tool contain financial stability risk,0.14115477254807585,False,False,False,False,False,False,False,False,False,False
789,which is made difficult by uncertainties about the cyclical position and monetary transmission,0.0,be make difficult uncertainty cyclical position monetary transmission,0.14122477607325945,False,False,False,False,False,False,False,False,False,False
387,"External and financial vulnerabilities have risen , and could be exacerbated",0.0,external financial vulnerability have rise could be exacerbate,0.1435081093705376,False,False,False,False,False,False,False,False,False,False
481,"This would help reduce the burden on monetary and fiscal policy to support the recovery , and minimize the real consequences of deleveraging",0.0,would help reduce burden monetary fiscal policy support recovery minimize real consequence deleverage,0.14523152249736782,False,False,False,False,False,False,False,False,False,False
552,"Hence , on balance fiscal consolidation should generally take priority , all else given",0.0,balance fiscal consolidation should take priority else give,0.14537031927787336,False,False,False,False,False,False,False,False,False,False
536,Private debt and financial vulnerabilities require attention,0.0,private debt financial vulnerability require attention,0.14576235467419763,False,False,False,False,False,False,False,False,False,False
570,that inflation is set to rise steadily toward the Federal Reserve 's two percent objective,0.0,inflation be set rise Federal Reserve percent objective,0.14906913851229908,False,False,False,False,False,False,False,False,False,False
683,"Central banks have been at the forefront of the policy response to the recent global slowdown , and should continue supporting the recovery ,",0.0,central bank have be forefront policy response recent global slowdown should continue support recovery,0.14938898486870877,False,False,False,False,False,False,False,False,False,False
418,"issuance has returned to pre crisis levels , and higher credit and liquidity risks taken by pension funds and insurance companies",0.0,issuance have return pre crisis level higher credit liquidity risk take pension fund insurance company,0.15074916346925094,False,False,False,False,False,False,False,False,False,False
803,Collective efforts to enhance the global safety net and strengthen the resilience of the International Monetary System IMS should be renewed,0.0,collective effort enhance global safety net strengthen resilience International Monetary System IMS should be renew,0.15164333283509301,False,False,False,False,False,False,False,False,False,False
861,Stricter regulation of nonperforming loans and measures to improve insolvency and foreclosure procedures are a priority in this regard,0.0,stricter regulation nonperforming loan measure improve insolvency foreclosure procedure be priority regard,0.15324192708582274,False,False,False,False,False,False,False,False,False,False
646,"The Fed 's policy should thus remain accommodative , including through its UMP ,",1.0,Fed policy should remain accommodative include ump,0.15348641892352632,True,True,True,True,True,True,True,True,False,False
658,"Accommodative monetary policies remain essential in many advanced economies , given still sizable output gaps",1.0,accommodative monetary policy remain essential many advanced economy give sizable output gap,0.15471359946709062,True,True,True,True,True,True,True,False,False,False
210,"Hence , plans for fiscal consolidation should generally take priority , all else given",0.0,plan fiscal consolidation should take priority else give,0.15526197318690693,False,False,False,False,False,False,False,False,False,False
217,"Also , authorities will need to remain vigilant against the prospect of deteriorating credit quality emerging as a result of the monetary policy easing undertaken so far",0.0,authority will need remain vigilant prospect deteriorate credit quality emerge result monetary policy ease undertake,0.1566941871277765,True,True,True,True,True,False,False,False,False,False
134,"Better central bank communications may help bring down real interest rates and provide added support to demand , including by reassuring markets against premature tightening",0.0,central bank communication may help bring real interest rate provide added support demand include reassure market premature tightening,0.15737288018767637,True,True,True,True,True,True,True,True,True,True
790,"This includes paying interest on excess reserves ,",0.0,include pay interest excess reserve,0.15817576759353214,False,False,False,False,False,False,False,False,False,False
748,This strikes the right balance between demand support and debt reduction,0.0,strike right balance demand support debt reduction,0.15891997539631786,False,False,False,False,False,False,False,False,False,False
499,"an accommodative monetary policy stance ,",0.0,accommodative monetary policy stance,0.16008137849187376,False,False,False,False,False,False,False,False,False,False
360,as underlying inflation is expected to remain very low,0.0,underlie inflation be expect remain low,0.16161425246690142,False,False,False,False,False,False,False,False,False,False
451,"economies , on the other hand , need to implement structural reforms to improve competitiveness ,",0.0,economy other hand need implement structural reform improve competitiveness,0.16352520159020334,False,False,False,False,False,False,False,False,False,False
97,while those with closed output gaps should withdraw fiscal stimulus and calibrate monetary policy to inflation developments,0.0,closed output gap should withdraw fiscal stimulus calibrate monetary policy inflation development,0.16438448957777474,True,True,True,True,True,True,True,True,False,False
697,while economies with external deficits may need to consider tightening macroprudential measures or using capital flow management measures in conjunction with monetary tightening,0.0,economy external deficit may need consider tighten macroprudential measure use capital flow management measure conjunction monetary tightening,0.16823301552378989,True,True,True,True,True,True,True,True,True,True
421,while at the same time having positive spillovers to other euro area economies,0.0,same time have positive spillover other euro area economy,0.16944990115090908,False,False,False,False,False,False,False,False,False,False
712,Progress on fiscal reform would also help quell concerns about political pressure on central banks to keep interest rates too low longer,0.0,Progress fiscal reform would help quell concern political pressure central bank keep interest rate,0.17239430722168625,False,False,False,False,False,False,False,False,False,False
245,which is currently expected around,0.0,be expect,0.17246045744672223,False,False,False,False,False,False,False,False,False,False
128,"More fiscal stimulus in advanced surplus economies with fiscal space , continuing monetary support and fiscal rebalancing in deficit economies , and structural reforms would contribute to external rebalancing",0.0,fiscal stimulus advanced surplus economy fiscal space continue monetary support fiscal rebalancing deficit economy structural reform would contribute external rebalancing,0.17373710190072933,False,False,False,False,False,False,False,False,False,False
204,A strong commitment to fully implement the asset purchase program and adjust the program,0.0,strong commitment implement asset purchase program adjust program,0.1799171507737375,False,False,False,False,False,False,False,False,False,False
221,"While monetary policy should continue supporting the recovery , challenges are increasingly different across countries",0.0,monetary policy should continue support recovery challenge be different country,0.18051263611881985,True,True,True,True,True,True,True,True,False,False
867,"Strengthening transparency , especially in communicating policy objectives and enhancing data quality , will be key to minimize spillovers and financial volatility",0.0,strengthen transparency communicate policy objective enhance datum quality will be key minimize spillover financial volatility,0.18249782984977891,False,False,False,False,False,False,False,False,False,False
338,that aided the functioning of repo markets,0.0,aid functioning repo market,0.18281260937470822,False,False,False,False,False,False,False,False,False,False
195,This will take pressure off monetary and prudential policies and create fiscal space to respond to future shocks,0.0,will take pressure monetary prudential policy create fiscal space respond future shock,0.18291028811916477,False,False,False,False,False,False,False,False,False,False
848,policy frameworks are imperative for a turnaround in confidence and investment,0.0,policy framework be imperative turnaround confidence investment,0.18347244292091647,False,False,False,False,False,False,False,False,False,False
377,"until the recovery is well established , while containing potentially adverse side effects",0.0,recovery be establish contain adverse side effect,0.18354511695419062,False,False,False,False,False,False,False,False,False,False
654,"Exchange rate flexibility , alongside credible macroeconomic policies and frameworks , has also proven to be an essential tool in coping with volatile capital flows",0.0,Exchange rate flexibility credible macroeconomic policy framework have prove be essential tool cope volatile capital flow,0.1840107117419475,False,False,False,False,False,False,False,False,False,False
166,In some advanced economies that have fiscal space and are operating at or close to capacity ,0.0,advanced economy have fiscal space be operate close capacity,0.1844335154678871,False,False,False,False,False,False,False,False,False,False
318,"as signs of an economic turnaround in the global economy become more prevalent , markets have begun to express their concern about the future ramifications of unprecedented policy actions and massive public intervention",0.0,sign economic turnaround global economy become prevalent market have begin express concern future ramification unprecedented policy action massive public intervention,0.1852451435479524,False,False,False,False,False,False,False,False,False,False
381,"Moving expeditiously to address the legacies of the crisis including bank funding concerns , the resolution of weak banks , and the restructuring of balance sheets for distressed households as well as to alleviate",0.0,move address legacy crisis include bank funding concern resolution weak bank restructuring balance sheet distressed household alleviate,0.1863442521923253,False,False,False,False,False,False,False,False,False,False
414,"Indeed , policy rates may need to rise",1.0,policy rate may need rise,0.1865379946521808,False,False,False,False,False,False,False,False,False,False
432,"The Federal Reserve , Bank of England , and Bank of Japan should stand ready to continue their deployment of unconventional measures and take further steps",1.0,Federal Reserve Bank England Bank Japan should stand ready continue deployment unconventional measure take further step,0.18679865687823305,True,True,True,True,True,True,True,True,False,False
567,policymakers will need to pay increasing attention to building inflationary pressure,0.0,policymaker will need pay increase attention build inflationary pressure,0.18855952730739245,False,False,False,False,False,False,False,False,False,False
725,Efforts to increase revenue mobilization and improve expenditure prioritization should continue,0.0,effort increase revenue mobilization improve expenditure prioritization should continue,0.18954349578426333,False,False,False,False,False,False,False,False,False,False
409,The reduction in inflation toward the 4 . percent target by 2017 will require a tight monetary policy stance,0.0,reduction inflation,0.1919715113991537,False,False,False,False,False,False,False,False,False,False
719,"The scale of fiscal adjustment required is large to ensure debt sustainability and to restore room for policy maneuver , particularly in advanced economies",0.0,scale fiscal adjustment require be large ensure debt sustainability restore room policy maneuver advanced economy,0.19368145120503344,False,False,False,False,False,False,False,False,False,False
315,"In such economies which include Brazil , India and Turkey there is room for further consolidation",0.0,such economy include Brazil India Turkey be room further consolidation,0.19469999248783454,False,False,False,False,False,False,False,False,False,False
744,"In China , the monetary expansion has quickly fed through to the domestic economy and there may be a need to tighten credit conditions in the face of sharply rising credit growth and the potential for overinvestment",1.0,China monetary expansion have feed domestic economy may be need tighten credit condition face rise credit growth potential overinvestment,0.195074656758081,True,True,True,True,True,True,True,True,True,True
782,fiscal policy should ensure,0.0,fiscal policy should ensure,0.19697645871556102,False,False,False,False,False,False,False,False,False,False
59,where fiscal space is limited and monetary policy operates close to the effective lower bound,1.0,fiscal space be limited monetary policy operate effective lower bind,0.19835448429897184,True,True,True,True,True,True,False,False,False,False
860,"Where monetary policy operates near or at the lower bound , fiscal policy has an important role to play",0.0,monetary policy operate lower bind fiscal policy have important role play,0.19845529629098702,False,False,False,False,False,False,False,False,False,False
215,"Fiscal consolidation should proceed gradually , anchored in credible plans ,",0.0,fiscal consolidation should proceed anchor credible plan,0.19954046418191984,False,False,False,False,False,False,False,False,False,False
281,job seekers find work faster or,0.0,job seeker find work,0.20038412608063472,False,False,False,False,False,False,False,False,False,False
621,"In Japan , incomes policies and structural reforms",0.0,Japan income policy structural reform,0.20135261305465646,False,False,False,False,False,False,False,False,False,False
602,"where needs have been identified , there is slack in the economy , and investment processes are relatively efficient for example , Germany and the United States",0.0,need have be identify be slack economy investment process be efficient example Germany United States,0.20188769547542096,False,False,False,False,False,False,False,False,False,False
458,A sound execution of the AQR and stress tests will be a key step toward reducing uncertainty about the health of banks and enabling balance sheet repair,0.0,sound execution AQR stress test will be key step reduce uncertainty health bank enable balance sheet repair,0.20218269958876234,False,False,False,False,False,False,False,False,False,False
747,"who were hurt severely by the housing bust , have made limited progress in repairing their balance sheets",0.0,be hurt housing bust have make limited progress repair balance sheet,0.20342097315324958,False,False,False,False,False,False,False,False,False,False
876,"While the recent cabinet decision on the fiscal and growth strategies is welcome , more concrete and decisive",0.0,recent cabinet decision fiscal growth strategy be welcome concrete decisive,0.20749701915676466,False,False,False,False,False,False,False,False,False,False
453,"rate flexibility can usefully cushion the impact of adverse external shocks , provided",0.0,rate flexibility can cushion impact adverse external shock provide,0.21040621974257334,False,False,False,False,False,False,False,False,False,False
71,"However , given the unevenness of the recovery across economies , challenges faced by central banks are different",0.0,give unevenness recovery economy challenge face central bank be different,0.21071218676890158,False,False,False,False,False,False,False,False,False,False
582,The right policies will also help to reduce external imbalances,0.0,right policy will help reduce external imbalance,0.21255483545402565,False,False,False,False,False,False,False,False,False,False
240,where the transmission mechanism is impaired,0.0,transmission mechanism be impaired,0.21345637033148224,False,False,False,False,False,False,False,False,False,False
696,"Economies with external surpluses should provide room for monetary tightening by allowing currencies to appreciate ,",0.0,economy external surplus should provide room monetary tightening allow currency appreciate,0.2135289102301815,True,True,True,True,True,True,True,True,False,False
87,"However , where financing conditions are easing and exchange rates have appreciated",0.0,financing condition be ease exchange rate have appreciate,0.2139484348012468,False,False,False,False,False,False,False,False,False,False
821,"ample liquidity and easy monetary policy , mainly in advanced economies",0.0,ample liquidity easy monetary policy advanced economy,0.21457816681485964,False,False,False,False,False,False,False,False,False,False
